"599501","0","1","2","0","0","767","0","0","1","1","1","0","0","0","0","0","0","False","False","False","看一看、看一看，有沒有想買的東西？<hex:02100103>我也在不斷增加商品數量，<hex:02100103>希望你能找到自己喜歡的。","0","0"
"599500","0","1","2","0","0","767","0","0","1","1","1","0","0","0","0","0","0","False","False","False","看一看、看一看，有沒有想買的東西？<hex:02100103>這一帶有很多危險的野生生物，<hex:02100103>所以能提供的商品數量有限，還請包涵。","0","0"
"599503","0","1","2","0","0","767","0","0","1","1","1","0","0","0","0","0","0","False","False","False","看一看、看一看，有沒有想買的東西？<hex:02100103>旅行者，是你幫忙解決了這一帶的危險生物嗎？<hex:02100103>為了表示感謝，我為你準備了特別的商品！","0","0"
"599502","0","1","2","0","0","767","0","0","1","1","1","0","0","0","0","0","0","False","False","False","看一看、看一看，有沒有想買的東西？<hex:02100103>似乎有旅行者幫忙打倒了危險的野生生物，<hex:02100103>現在能籌備的商品數量增加了很多！","0","0"
"599489","0","0","0","0","0","0","0","0","0","0","0","0","0","0","0","0","0","False","False","False","","",""
"599488","0","0","0","0","0","0","0","0","0","0","0","0","0","0","0","0","0","False","False","False","","",""
"599491","0","1","2","0","0","764","0","0","1","1","1","0","0","0","0","0","0","False","False","False","你好、你好！我們這裡是魚店！<hex:02100103>店裡的每條魚都是新鮮到貨，歡迎挑選！","0","0"
"599490","0","0","0","0","0","0","0","0","0","0","0","0","0","0","0","0","0","False","False","False","","",""
"599493","0","1","2","0","0","767","0","0","1","1","1","0","0","0","0","0","0","False","False","False","歡迎光臨！<hex:02100103>本店既不使用佩魯也不使用金幣，<hex:02100103>而是使用雙色寶石作為全新的嘗試進行交易！","0","0"
"599492","0","1","2","0","0","767","0","0","1","1","1","0","0","0","0","7","0","False","False","False","非常抱歉，本店目前正在停業當中。<hex:02100103>由於前不久運輸商品時遭到魔物襲擊，貨物都被毀了……<hex:02100103>目前正在準備重新進貨，歡迎到時再來！","需要將「主線任務：黃金的遺產」推進到特定的階段<hex:02100103>才能開始與當前地區的廣域交易商進行交易。","0"
"599495","0","1","2","0","0","767","0","0","1","1","1","0","0","0","0","0","0","False","False","False","走過路過不容錯過！<hex:02100103>最近遭遇魔物襲擊的次數減少了，<hex:02100103>所以我嘗試著稍微增加了一點進貨的商品數量！","0","0"
"599494","0","1","2","0","0","767","0","0","1","1","1","0","0","0","0","0","0","False","False","False","走過路過不容錯過！<hex:02100103>為了避免在運輸途中因受魔物襲擊而貨物全失，<hex:02100103>我們每次進貨的商品數量都不會太多。","0","0"
"599513","0","1","2","0","0","767","0","0","1","1","1","0","0","0","0","0","0","False","False","False","商品的數量可能不是那麼充足，但目前就是這些啦。<hex:02100103>這附近能籌備到的商品種類有所增加，<hex:02100103>希望你能找到自己想要的。","0","0"
"599512","0","1","2","0","0","767","0","0","1","1","1","0","0","0","0","0","0","False","False","False","商品的數量可能不太夠，但目前只有這些啦。<hex:02100103>魔物現在開始逐漸出現在了道路兩旁，<hex:02100103>使得商品的運輸工作難度倍增。","0","0"
"599515","0","1","2","0","0","767","0","0","1","1","1","0","0","0","0","0","0","False","False","False","目前的商品數量繁多，種類豐富！<hex:02100103>這一帶的魔物最近安分了不少，<hex:02100103>我也因此籌備到了一些平時很少能見到的稀有商品。","0","0"
"599514","0","1","2","0","0","767","0","0","1","1","1","0","0","0","0","0","0","False","False","False","目前的商品是這些。<hex:02100103>幸好有身手不錯的人幫忙打倒了魔物，<hex:02100103>我也是趁著安全的時候籌備了很多東西。","0","0"
"599517","0","1","2","0","0","767","0","0","1","1","1","0","0","0","0","0","0","False","False","False","你來得正好。<hex:02100103>再造者為我提供了一些商品，<hex:02100103>如果有你想要的，就用雙色寶石來交換吧。","0","0"
"599516","0","1","2","0","0","767","0","0","1","1","1","0","0","0","0","7","0","False","False","False","啊，你好。<hex:02100103>這裡負責提供不會循環使用的商品，<hex:02100103>不過目前庫存不足……請改天再來吧。","需要將「主線任務：黃金的遺產」推進到特定的階段<hex:02100103>才能開始與當前地區的廣域交易商進行交易。","0"
"599519","0","1","2","0","0","767","0","0","1","1","1","0","0","0","0","0","0","False","False","False","有什麼中意的商品嗎？<hex:02100103>剛好再造者稍微多帶來了一些東西，<hex:02100103>所以商品數量增加了一些，你好好看看吧。","0","0"
"599518","0","1","2","0","0","767","0","0","1","1","1","0","0","0","0","0","0","False","False","False","有什麼中意的商品嗎？<hex:02100103>但似乎因為魔物的活動，再造者的工作也變得困難了起來，<hex:02100103>所以現在商品數量很少，請你多多包涵了。","0","0"
"599505","0","1","2","0","0","767","0","0","1","1","1","0","0","0","0","0","0","False","False","False","有什麼想買的東西嗎？<hex:02100103>我剛好進了一批貨，<hex:02100103>需要的話就請使用雙色寶石來交易吧。","0","0"
"599504","0","1","2","0","0","767","0","0","1","1","1","0","0","0","0","7","0","False","False","False","雖然我也想與你交易，但很不巧本店正在停業當中。<hex:02100103>你也知道，目前氣球暫時停止了運作，所以無法備貨。<hex:02100103>等運輸恢復了歡迎再來光顧。","需要將「主線任務：黃金的遺產」推進到特定的階段<hex:02100103>才能開始與當前地區的廣域交易商進行交易。","0"
"599507","0","1","2","0","0","767","0","0","1","1","1","0","0","0","0","0","0","False","False","False","目前店裡的庫存勉勉強強夠用。<hex:02100103>雖然因野獸肆虐導致商品籌備工作進行得不順利，<hex:02100103>但我還是嘗試補充了一些新商品。","0","0"
"599506","0","1","2","0","0","767","0","0","1","1","1","0","0","0","0","0","0","False","False","False","目前店裡的庫存已經快要見底了。<hex:02100103>由於現在前往森林狩獵野獸的人手不足，<hex:02100103>在林中行動很危險，進貨工作也因此停滯了。","0","0"
"599509","0","1","2","0","0","767","0","0","1","1","1","0","0","0","0","0","0","False","False","False","目前店裡的庫存豐富到無法想像，<hex:02100103>其中應該也有很多能引起你興趣的珍品，<hex:02100103>你就放心選購吧。","0","0"
"599508","0","1","2","0","0","767","0","0","1","1","1","0","0","0","0","0","0","False","False","False","目前店裡的庫存比剛開店那會增加了很多。<hex:02100103>森林裡的野獸數量得到控制，進貨工作也順暢了很多，<hex:02100103>所以現在店裡的商品無論是數量還是種類都豐富了不少。","0","0"
"599511","0","1","2","0","0","767","0","0","1","1","1","0","0","0","0","0","0","False","False","False","看看有什麼想要的嗎？<hex:02100103>我採購了一些當地特產，<hex:02100103>請使用雙色寶石與我進行交易。","0","0"
"599510","0","1","2","0","0","767","0","0","1","1","1","0","0","0","0","7","0","False","False","False","我雖然是一名旅行商人，<hex:02100103>但打算暫時在這裡停留一段時間。<hex:02100103>目前我還在補充商品，之後你再過來找我交易吧。","需要將「主線任務：黃金的遺產」推進到特定的階段<hex:02100103>才能開始與當前地區的廣域交易商進行交易。","0"
"599529","0","1","2","0","0","767","0","0","1","1","1","0","0","0","0","0","0","False","False","False","哦這位客人，很抱歉，<hex:02100103>目前本店正在為開店做準備。<hex:02100103>等準備好後你再過來吧。","0","0"
"599528","0","1","0","0","0","0","0","0","1","1","1","0","0","0","7","7","0","False","False","False","可以和當前區域的廣域交易商進行交易了！<hex:02100103>在廣域交易商處可使用雙色寶石交換多種道具。","另外，提升危命任務的完成次數<hex:02100103>可以相應增加該區域廣域交易商提供的道具種類。<hex:02100103>建議積極參加危命任務。","0"
"599531","0","1","2","0","0","767","0","0","1","1","1","0","0","0","0","7","0","False","False","False","不好意思，這位客人，<hex:02100103>目前本店正在為開店做準備。<hex:02100103>請過一陣再來光顧吧。","需要使奧闊帕恰山、科薩瑪爾卡溼地、雅克特爾樹海、夏洛尼荒野、<hex:02100103>遺產之地、活著的記憶的危命任務完成度達到4級<hex:02100103>才能開始與此廣域交易商進行交易。","0"
"599530","0","1","2","0","0","767","0","0","1","1","1","0","0","0","0","7","0","False","False","False","不好意思，這位客人，<hex:02100103>目前本店正在為開店做準備。<hex:02100103>請過一陣再來光顧吧。","需要將「主線任務：黃金的遺產」推進到特定的階段<hex:02100103>才能開始與當前地區的廣域交易商進行交易。","0"
"599533","0","1","2","0","0","767","0","0","1","1","1","0","0","0","0","0","0","False","False","False","歡迎光臨。<hex:02100103>本店從各地進了不少好東西。","0","0"
"599532","0","1","2","0","0","767","0","0","1","1","1","0","0","0","0","0","0","False","False","False","歡迎光臨。<hex:02100103>本店從各地進了不少好東西，<hex:02100103>可以的話請用雙色寶石來交換。","0","0"
"599535","0","1","2","0","0","767","0","0","1","1","1","0","0","0","0","7","0","False","False","False","難得你來一趟，真是抱歉！<hex:02100103>由於派送員出現失誤，導致商品未能及時送達，<hex:02100103>不好意思，請你改天再來吧！","需要將「主線任務：黃金的遺產」推進到特定的階段<hex:02100103>才能開始與當前地區的廣域交易商進行交易。","0"
"599534","0","1","2","0","0","767","0","0","1","1","1","0","0","0","0","0","0","False","False","False","難得你來一趟，真是抱歉！<hex:02100103>由於派送員出現失誤，導致商品未能及時送達，<hex:02100103>不好意思，請你改天再來吧！","0","0"
"599521","0","1","2","0","0","767","0","0","1","1","1","0","0","0","0","0","0","False","False","False","有什麼中意的商品嗎？<hex:02100103>如今工作環境變安全了，再造者們也都心情愉悅，<hex:02100103>還會提供挖掘出來的東西作為商品。","0","0"
"599520","0","1","2","0","0","767","0","0","1","1","1","0","0","0","0","0","0","False","False","False","有什麼中意的商品嗎？<hex:02100103>最近再造者已經很少被魔物的妨礙工作了，<hex:02100103>所以為我帶來了大量商品。","0","0"
"599523","0","1","2","0","0","767","0","0","1","1","1","0","0","0","11","0","0","False","False","False","歡迎來到活著的記憶。<hex:02100103>來訪的客人可以透過本窗口使用雙色寶石交換獎品。","0","0"
"599522","0","1","2","0","0","767","0","0","1","1","1","0","0","0","11","7","0","False","False","False","目前本窗口已停止接待。<hex:02100103>很抱歉為客人造成了困擾，敬請諒解。","需要將「主線任務：黃金的遺產」推進到特定的階段<hex:02100103>才能開始與當前地區的廣域交易商進行交易。","0"
"599525","0","1","2","0","0","767","0","0","1","1","1","0","0","0","11","0","0","False","False","False","以下是本窗口可以交換的獎品。<hex:02100103>由於你為維護設施安全做出了貢獻，<hex:02100103>我們為你增加了獎品。","0","0"
"599524","0","1","2","0","0","767","0","0","1","1","1","0","0","0","11","0","0","False","False","False","以下是本窗口可以交換的獎品。<hex:02100103>對於為維護設施的安全提供幫助的客人，<hex:02100103>我們還將追加獎品，請積極維護設施安全。","0","0"
"599527","0","1","2","0","0","767","0","0","1","1","1","0","0","0","11","0","0","False","False","False","這邊是可以交換的具體商品。<hex:02100103>由於你為維護設施安全作出了巨大貢獻，<hex:02100103>我們為你增加了稀有獎品。","0","0"
"599526","0","1","2","0","0","767","0","0","1","1","1","0","0","0","11","0","0","False","False","False","這邊是可以交換的具體商品。<hex:02100103>由於你為維護設施安全付出了努力，<hex:02100103>我們為你增加了獎品。","0","0"
"599545","0","1","2","0","0","764","0","0","1","1","1","0","0","0","0","0","0","False","False","False","請問您擁有羅薇娜商會發行的工票嗎？<hex:02100103>如果您想要使用工票進行交換的話，<hex:02100103>就請您看看可供交換的物品的目錄吧。","0","0"
"599544","0","1","2","0","0","764","0","0","1","1","1","0","0","0","0","0","0","False","False","False","這裡是羅薇娜商會的交易窗口。<hex:02100103>本窗口目前尚未開放新的交易，<hex:02100103>請下次再來。","0","0"
"599547","0","1","2","0","0","764","0","0","1","1","1","0","0","0","0","0","0","False","False","False"," <hex:022903EB0203> 大人，歡迎。本店的商品種類繁多，面向各類人群。<hex:02100103>無論是身手不凡的狩獵者還是經驗豐富的技師，<hex:02100103>都能在本店購入所需的物品。","0","0"
"599546","0","1","2","0","0","764","0","0","1","1","1","0","0","0","0","0","0","False","False","False","這裡是羅蒂娜商會的交易窗口。<hex:02100103>本窗口目前尚未開放新的交易，<hex:02100103>請下次再來。","0","0"
"599549","0","1","2","0","0","763","0","0","1","1","1","0","0","0","0","0","0","False","False","False","歡迎歡迎！<hex:02100103>如果你擅長製作或採集的話，<hex:02100103>可以去找瑪利哈利承接工作！","0","0"
"599548","0","1","2","0","0","763","0","0","1","1","1","0","0","0","0","0","0","False","False","False","這裡是智理院的接待窗口。<hex:02100103>也會負責為工匠介紹工作，<hex:02100103>如果您感興趣的話，就請去找瑪利哈利吧。","0","0"
"599551","0","0","0","0","0","0","0","0","0","0","0","0","0","0","0","0","0","False","False","False","","",""
"599550","0","1","2","0","0","764","0","0","1","1","1","0","0","0","0","0","0","False","False","False","本店是一家五金店，<hex:02100103>主要銷售以日常生活用的工具為主的各類金屬製品。<hex:02100103>如果你需要鍋之類的工具，隨時歡迎你的光顧。","0","0"
"599537","0","1","2","0","0","767","0","0","1","1","1","0","0","0","0","0","0","False","False","False","歡迎光臨！<hex:02100103>本店準備了這一帶很少見的商品，<hex:02100103>請使用雙色寶石進行交換！","0","0"
"599536","0","1","2","0","0","767","0","0","1","1","1","0","0","0","0","7","0","False","False","False","難得你來一趟，真是抱歉！<hex:02100103>由於派送員出現失誤，導致商品未能及時送達，<hex:02100103>不好意思，請你改天再來吧！","需要使奧闊帕恰山、科薩瑪爾卡溼地、雅克特爾樹海、夏洛尼荒野、<hex:02100103>遺產之地、活著的記憶的危命任務完成度達到4級<hex:02100103>才能開始與此廣域交易商進行交易。","0"
"599539","0","1","0","0","0","0","0","0","1","1","1","0","0","0","7","0","0","False","False","False","可以和當前區域的廣域交易商進行交易了！<hex:02100103>在廣域交易商處可使用雙色寶石交換多種道具。","0","0"
"599538","0","1","2","0","0","767","0","0","1","1","1","0","0","0","0","0","0","False","False","False","歡迎光臨！<hex:02100103>本店準備了很棒的稀有商品，請好好看看吧！","0","0"
"599541","0","1","2","0","0","5695","5734","0","1","1","1","605","0","0","0","0","0","False","False","False"," <hex:022C0DFF07022903EB0203FF02200203> ，歡迎！<hex:02100103>今天是要來買日用品嗎？<hex:02100103>還是單純想跟我打個招呼？","方便的話，等你有空的時候，<hex:02100103>可以請你多跟我講講國外的金屬加工技術嗎？<hex:02100103>畢竟你的技術真的很出色！","0"
"599540","0","1","2","0","0","9058","5696","0","1","1","1","605","0","0","0","0","0","False","False","False","與你共事讓我學到了很多東西。<hex:02100103>今後我不會輕易給自己設限……<hex:02100103>努力成為一名更加出色的工匠。","方便的話也去跟帕帕尼打個招呼吧，<hex:02100103>畢竟她也是發自內心地尊敬你。","0"
"599543","0","1","2","0","0","764","0","0","1","1","1","0","0","0","0","0","0","False","False","False","請問您擁有能夠證明工匠手藝的工票嗎？<hex:02100103>如果您想要使用工票進行交換的話，<hex:02100103>就請您看看可供交換的物品的目錄吧。","0","0"
"599542","0","1","2","0","0","764","0","0","1","1","1","0","0","0","0","0","0","False","False","False","這裡是羅蒂娜商會的交易窗口。<hex:02100103>本商會目前尚未開放新的交易，<hex:02100103>請下次再來。","0","0"
"599561","0","1","2","0","0","5696","0","0","1","1","1","0","0","0","0","0","0","False","False","False","喲，是 <hex:022C0DFF07022903EB0203FF02200203> 大人。<hex:02100103>距離中量級比賽開始還有一段時間，請耐心等候。","0","0"
"599560","0","1","2","0","0","764","0","0","1","1","1","0","0","0","0","0","0","False","False","False","呵呵呵……亞納姐似乎想努力變得像你一樣強。<hex:02100103>姐姐性格坦率，輸了也會大方承認，<hex:02100103>這是她的優點。","0","0"
"599563","0","1","2","0","0","764","0","0","1","1","1","0","0","0","0","0","0","False","False","False","接下來才是重頭戲。","0","0"
"599562","0","1","2","0","0","5665","0","0","1","1","1","0","0","0","0","0","0","False","False","False","沒想到拉瑪提會和那個巴庫加加交心……<hex:02100103>我的妹妹總是這樣出人意料。","0","0"
"599565","0","1","2","0","0","763","0","0","1","1","1","0","0","0","0","0","0","False","False","False","為了能實現民眾的要求，即便知道可能會對試煉造成不利影響，<hex:02100103>烏克．拉瑪特還是選擇了向柯納王子求助。<hex:02100103>這很符合烏克．拉瑪特的作風，但不是每個人都能做到這一步。","0","0"
"599564","0","1","2","0","0","764","0","0","1","1","1","0","0","0","0","0","0","False","False","False","大家雖然看起來很疑惑，<hex:02100103>但似乎都很信任巴庫加加。","0","0"
"599567","0","1","2","0","0","764","0","0","1","1","1","0","0","0","0","0","0","False","False","False","你叫我們過來就是讓我們在這乾等著？<hex:02100103>有什麼事就趕緊說吧！","0","0"
"599566","0","1","2","0","0","4218","0","0","1","1","1","0","0","0","0","0","0","False","False","False","星芒マーケットへご案内しましょうか？<hex:02100103>現在開催中で、中はとっても賑やかですよ！","0","0"
"599553","0","1","0","0","0","766","0","0","1","1","1","0","0","0","0","0","0","False","False","False","伊陶喀可能正在苦戰。<hex:02100103>現在需要對大海對面的土地比較瞭解的幫手……","0","0"
"599552","0","0","0","0","0","0","0","0","0","0","0","0","0","0","0","0","0","False","False","False","","",""
"599555","0","1","2","0","0","5734","0","0","1","1","1","0","0","0","0","0","0","False","False","False","鳳蝶的祭器十分重要，請務必幫忙把它奪回來！","0","0"
"599554","0","1","2","0","0","763","0","0","1","1","1","0","0","0","0","0","0","False","False","False","到達黃金港之後，<hex:02100103>可以先去類似這個酒館的地方打聽一下伊陶喀的行蹤。<hex:02100103>找到她之後，也拜託你幫助她奪回祭器！","0","0"
"599557","0","1","1","0","0","9072","0","9074","1","1","1","0","0","0","0","0","0","False","False","False","澤莫韋尼的委託已經告一段落，<hex:02100103>感覺休息休息，去旅行一下也是個不錯的選擇。","我也想像曾祖父那樣接觸各類文化，<hex:02100103>切身感受一下人們思想上的傳承。","當然我對外國也很感興趣。<hex:02100103>聽說在知識之都還有大書院，對於愛書的人來說簡直是天堂！<hex:02100103>有機會一定要去看一下！"
"599556","0","1","1","0","0","764","0","0","1","1","1","0","0","0","0","7","7","False","False","False","非常抱歉。<hex:02100103>這裡只對在圖拉爾魔物狩獵協會註冊過的人開放。","要接受圖萊尤拉的支線任務「圖拉爾大陸的初階魔物狩獵」<hex:02100103>需滿足以下條件。","1.完成支線任務「伊修加爾德的惡名菁英」。<hex:02100103>2.完成「黃金的遺產主線任務」中的「繼位儀式」。"
"599559","0","1","2","0","0","5695","0","0","1","1","1","0","0","0","0","0","0","False","False","False","喲， <hex:022C0DFF07022903EB0203FF02200203> 。<hex:02100103>我正在和妹妹一起尋找靈魂壞死症的治療方法。","你接下來要挑戰的中量級比賽當中都是百裡挑一的強者。<hex:02100103>比賽開始前，好好磨練自己的身手吧！","0"
"599558","0","1","2","0","0","738","0","0","1","1","1","0","0","0","0","0","0","False","False","False","歡迎光臨！<hex:02100103>下次回故鄉的時候，我打算把那本書也帶回去，<hex:02100103>讀給家裡人聽。","如果以後有機會，<hex:02100103>我還想聽聽你的故事。<hex:02100103>店裡的客人也都很感興趣！","0"
"599577","0","1","2","0","0","763","0","0","1","1","1","0","0","0","0","0","0","False","False","False","我一定會將從父親那裡繼承的東西用在正道上！","0","0"
"599576","0","1","2","0","0","764","0","0","1","1","1","0","0","0","0","0","0","False","False","False","アルシャールさんとプリッシュちゃんのこと、任せたわね。","それと、息子にも伝えておいてくれる？<hex:02100103>あまり頑張りすぎないように、ってね。","0"
"599579","0","1","2","0","0","5696","0","0","1","1","1","0","0","0","0","0","0","False","False","False","其實我也想跟你一起去。<hex:02100103>但這次我還是留下來目送你前行好了。","無論旅途前方等待的是什麼，願希望之光常伴你身側。<hex:02100103>等你回來了，再跟我講講你的冒險故事吧？","0"
"599578","0","1","2","0","0","4219","0","0","1","1","1","0","0","0","0","0","0","False","False","False","……說實話，我也非常想去那邊看看，<hex:02100103>甚至恨不得立刻跳入那道光中。","但是為了應對意外情況，必須留人確保退路通暢，<hex:02100103>必要時從原初世界這邊把門打開。<hex:02100103>我可不想冒著失去你們的風險去滿足自己的探索欲。","0"
"599581","0","1","2","0","0","5696","0","0","1","1","1","0","0","0","0","0","0","False","False","False","在來這裡的路上，我看到了一隻形似龍的巨蜥。<hex:02100103>看上去感覺蠻好吃的，我準備等一下去把它捕回來。","到時候我們一邊拿它當下酒菜，一邊回味你過往的經歷。","0"
"599580","0","1","2","0","0","763","0","0","1","1","1","0","0","0","0","0","0","False","False","False","我知道……<hex:02100103>我也不是個小孩子了，道理我都懂。","你選擇的道路沒有錯，放心前進吧。<hex:02100103>你珍視的那些事物就交給我們守護！<hex:02100103>願你一路順風！","0"
"599583","0","1","2","0","0","4218","0","0","1","1","1","0","0","0","0","0","0","False","False","False","放心吧，這些人由我來保護。<hex:02100103>你就好好去完成只有你才能做到的事情吧。","0","0"
"599582","0","1","2","0","0","764","0","0","1","1","1","0","0","0","0","0","0","False","False","False","這裡有各個領域的專家為你保駕護航，<hex:02100103>所以你就放心踏上跨越次元的新旅途吧。","0","0"
"599569","0","1","0","0","0","755","0","0","1","1","1","0","0","0","0","0","0","False","False","False","早知道應該把挖掘工具帶來的……","0","0"
"599568","0","1","2","0","0","4219","0","0","1","1","1","0","0","0","0","0","0","False","False","False","受到隕石釋放的乙太的影響，下面的森林變成了這個樣子……<hex:02100103>這棵樹如此高大，是因為吸收了隕石本身嗎？","0","0"
"599571","0","1","0","0","0","755","0","0","1","1","1","0","0","0","0","0","0","False","False","False","這還真不是一般的大啊。<hex:02100103>埃倫維爾，來幫幫忙。<hex:02100103>我準備削掉一部分。","0","0"
"599570","0","1","1","0","0","755","0","0","1","1","1","0","0","0","0","0","0","False","False","False","樣本自然是越多越好。<hex:02100103>大家一起收集的話，肯定很快就能夠數的！","0","0"
"599573","0","1","2","0","0","5695","0","0","1","1","1","0","0","0","0","0","0","False","False","False","我相信烏克．拉瑪特公主，<hex:02100103>就在這裡等她帶回好消息！","0","0"
"599572","0","1","2","0","0","764","0","0","1","1","1","0","0","0","0","0","0","False","False","False","很高興你願意來了解我們。<hex:02100103>但事到如今，又能改變什麼呢……","0","0"
"599575","0","1","0","0","0","766","0","0","1","1","1","0","0","0","0","0","0","False","False","False","ブネワ族の高位賢士にしか扱えない呪法……<hex:02100103>犯人はいったい……？","0","0"
"599574","0","1","2","0","0","5696","0","0","1","1","1","0","0","0","0","0","0","False","False","False","一直以來我們都是選擇跟其他種族保持距離的，<hex:02100103>你居然會願意接近我們……","0","0"
