"599325","0","1","2","0","0","4219","0","0","1","1","1","0","0","0","0","0","0","False","False","False","不好意思，出去尋找新對手的老師還沒有消息。","0","0"
"599324","0","1","1","0","0","4218","0","0","1","1","1","0","0","0","0","0","0","False","False","False","我們已經從尤盧斯閣下那裡瞭解了情況。<hex:02100103>雖說格奈烏斯閣下已經允許進入，<hex:02100103>但也千萬小心行事，不要惹出麻煩。","0","0"
"599327","0","1","2","0","0","933","0","0","1","1","1","0","0","0","0","0","0","False","False","False","不用對老師客氣。<hex:02100103>把金德爾打得落花流水吧！","0","0"
"599326","0","1","2","0","0","4301","0","0","1","1","1","0","0","0","0","0","0","False","False","False","不知道老師扮演的對手會是什麼樣的風格呢……<hex:02100103>真是令人期待啊！","0","0"
"599337","0","1","2","0","0","958","0","0","1","1","1","0","0","0","5","5","0","False","False","False","帕薩松一直黏著我，真是夠嗆。<hex:02100103>等我的翅膀癒合，能回到島上的時候，<hex:02100103>不知道他會不會跟來啊……","不過誰讓我宅心仁厚呢！<hex:02100103>還是暫時先繼續照顧一下他吧，呵呵！","0"
"599336","0","1","2","0","0","0","0","0","1","1","1","0","0","0","5","0","0","False","False","False","雖然不能一起著實可惜，<hex:02100103>不過島上的事情還是要繼續拜託你了！","0","0"
"599339","0","1","2","0","0","763","0","0","1","1","1","0","0","0","0","0","0","False","False","False","0","0","0"
"599338","0","1","2","0","0","763","0","0","1","1","1","0","0","0","0","0","0","False","False","False","戴米爾遺烈鄉充斥著強烈的鍊金藥的氣息，<hex:02100103>考慮到卡利卡的身體狀況，於是我們決定在這邊照顧它。","如今它的翅膀的傷勢也有了好轉，<hex:02100103>是時候把藥餌換成普通的餌了……<hex:02100103>另外為了讓它開心，還得準備美味的食物才行。","0"
"599341","0","1","2","0","0","764","0","0","1","1","1","0","0","0","11","0","0","False","False","False","沙沙沙……要求同盟者執行<hex:02100103>對失控的全身毛茸茸的有機生命體的陪同及監督任務。<hex:02100103>咖啡廳營運戰線的維護工作由本機負責。","0","0"
"599340","0","1","2","0","0","5533","0","0","1","1","1","0","0","0","0","0","0","False","False","False","0","0","0"
"599343","0","1","1","0","0","765","0","0","1","1","1","0","0","0","0","0","0","False","False","False","最近除了報紙以外，我還會透過收音機來收集情報，<hex:02100103>前不久聽到有比賽實況，感覺有些好笑！<hex:02100103>也不知道有幾分是真的！","0","0"
"599342","0","1","1","0","0","765","9074","0","1","1","1","0","605","0","0","0","0","False","False","False","你知道兔兔族們廣播的事情嗎？<hex:02100103>我前兩天剛跟朋友們一起透過收音機收聽了，<hex:02100103>據說是在宇宙盡頭進行的比賽，著實讓我吃了一驚。","他們究竟是用了怎樣的魔法啊？<hex:02100103>呵呵，我對魔法沒有抵抗力，特別感興趣。","0"
"599329","0","1","2","0","0","4218","0","0","1","1","1","0","0","0","0","0","0","False","False","False","不愧是我的弟子……","0","0"
"599328","0","1","2","0","0","1071","0","0","1","1","1","0","0","0","0","0","0","False","False","False","喲， <hex:022C0DFF07022903EB0203FF02200203> ……<hex:02100103>啊不對，我是金德爾，<hex:02100103>是你的敵人，所以別隨便套關係！","0","0"
"599331","0","1","2","0","0","5696","0","0","1","1","1","0","0","0","0","0","0","False","False","False","我光是守護倖存者的生活就已經筋疲力盡了，<hex:02100103>但是格奈烏斯閣下卻在為國家描繪著嶄新的未來。<hex:02100103>真是可靠。","0","0"
"599330","0","1","2","0","0","5665","0","0","1","1","1","0","0","0","0","0","0","False","False","False","沒想到我居然會成為反派。<hex:02100103>我自認為身上一點壞人的因素都沒有，<hex:02100103>你覺得呢？","0","0"
"599333","0","1","2","0","0","4218","1071","0","1","1","1","0","0","0","0","0","0","False","False","False","我已經從埃斯蒂尼安那裡聽說，<hex:02100103>瓦爾桑還沒有放棄拯救姐姐。","這邊你不用擔心，<hex:02100103>瓦爾桑……就拜託你了！","0"
"599332","0","1","2","0","0","764","0","0","1","1","1","0","0","0","0","0","0","False","False","False","請保持安靜。<hex:02100103>裡面有人在休息。","0","0"
"599335","0","1","2","0","0","5696","0","0","1","1","1","0","0","0","0","0","0","False","False","False","你曾多次幫助薩維奈度過危機，<hex:02100103>有了你的到來，相信星戰士團的同伴們也會士氣大振。<hex:02100103>希望你今後也可以經常過來！","0","0"
"599334","0","1","2","0","0","764","0","0","1","1","1","0","0","0","0","0","0","False","False","False","自從寶物殿發生爆炸之後，<hex:02100103>上面認為沿岸地區的防備工作果然還是不可或缺的。<hex:02100103>這個監視所今後也會繼續投入使用。","0","0"
"599353","0","1","1","0","0","755","755","0","1","1","1","0","0","0","0","0","0","False","False","False","本個體可以與全個體真正分享心中所想的地方……<hex:02100103>不，是即使無法分享，也可以和平相處的地方。<hex:02100103>我現在終於明白，這個地方就是這間咖啡廳。","同時還得到了「比賽」這樣一個適合與他人交流的話題。<hex:02100103>我會好好享受與這裡的客人們交流的時光的。","0"
"599352","0","1","2","0","0","1041","0","0","1","1","1","0","0","0","0","0","0","False","False","False","真沒想到會跟自由聯盟的傢伙組成統一戰線，<hex:02100103>還騎著「那個」和平捍衛者參加比賽。<hex:02100103>哈哈，世事真是無常啊。","0","0"
"599355","0","1","1","0","0","755","0","0","1","1","1","0","0","0","0","0","0","False","False","False","喲，曼德維爾武器用起來怎麼樣？<hex:02100103>不過畢竟是本大爺製作的東西，毫無疑問是最棒的了。","如果想對其他曼德維爾武器進行強化的話，<hex:02100103>就去找旁邊那個光溜溜的大叔問問看吧。<hex:02100103>不過最後的調整工作還是交給我吧！","0"
"599354","0","1","1","0","0","755","0","0","1","1","1","0","0","0","0","0","0","False","False","False","只有不好的預感……","0","0"
"599357","0","1","2","0","0","764","0","0","1","1","1","0","0","0","0","0","0","False","False","False","哎呀，你也正在休假嗎？<hex:02100103>還是說你有事找母親？","回到家中之後，<hex:02100103>我反而更加掛念身在加雷馬的人們。<hex:02100103>為了讓他們能夠擁有溫暖的家……我也得好好想想自己還能做什麼。","0"
"599356","0","1","2","0","0","5695","0","0","1","1","1","0","0","0","0","0","0","False","False","False","還有其他需要強化的武器。<hex:02100103>今後我也會繼續努力精進，請多指教！","0","0"
"599359","0","1","2","0","0","5665","0","5533","1","1","1","0","0","0","0","0","0","False","False","False","不僅僅是阿爾菲諾和阿莉塞，<hex:02100103>這段時間我們也受了你很多的照顧。<hex:02100103>雖然現在說這話有些後知後覺，但你的確配得上英雄的稱號。","你跨越了國家與民族的隔閡，<hex:02100103>選擇為更加重要的東西而戰……<hex:02100103>甚至還跟異世界的人結下了友誼。","在親眼見證了這樣的奇蹟之後，<hex:02100103>我相信我們加雷馬人也可以無往不利。<hex:02100103>我們會以你為榜樣，努力實現自己的夢想。"
"599358","0","1","2","0","0","933","0","0","1","1","1","0","0","0","0","0","0","False","False","False","拉札罕的宴會怎麼樣啊？<hex:02100103>雖然我也很想見見薩維奈島的人們，<hex:02100103>不過還是決定把機會留到下次。","畢竟我也很久沒有享受過一家團圓的感覺了。<hex:02100103>父親也說了想跟你好好聊聊，<hex:02100103>下次我們會正式邀請你的。","0"
"599345","0","1","2","0","0","763","0","0","1","1","1","0","0","0","0","0","0","False","False","False","喲， <hex:022C0DFF07022903EB0203FF02200203> ！<hex:02100103>天外天垓的比賽很有趣啊！","我最近在工作之餘還抽出了一些時間用來飆車，<hex:02100103>下次有機會的話，要不要在這邊也舉辦一場比賽啊？<hex:02100103>身為飆車族，怎麼可能甘心就這樣認輸！","0"
"599344","0","1","1","0","0","765","0","0","1","1","1","0","0","0","0","0","0","False","False","False","最近兔兔族的廣播內容熱度很高，<hex:02100103>我和拾穗人朋友們聊得熱火朝天。<hex:02100103>前段時間廣播的比賽真是令人熱血沸騰！","0","0"
"599347","0","1","2","0","0","763","768","0","1","1","1","0","0","0","0","0","0","False","False","False","我知道，我的河馬，喜歡什麼了。<hex:02100103>它平時，散步的時候，喜歡聞花香。","接下來，我會用它喜歡的花朵，製成香袋！<hex:02100103>下次比賽，我贏定了！","0"
"599346","0","1","2","0","0","764","4219","0","1","1","1","0","0","0","0","0","0","False","False","False","大姐頭之前去參加比賽，<hex:02100103>結果從當地帶回來一些吃的……","話說那個宇宙辛香料到底是什麼啊？！<hex:02100103>那刺激的辣味和香味完全不輸給這裡的辛香料，真是太棒了！","0"
"599349","0","1","2","0","0","763","764","0","1","1","1","605","605","0","0","0","0","False","False","False","天外天垓的比賽實況比想像中的還要有趣啊。","我從聽眾那裡瞭解到，<hex:02100103>這已經在舊薩雷安的背水咖啡廳成為了熱門話題。<hex:02100103>希望今後也可以為聽眾們奉上更多精彩的廣播內容。","0"
"599348","0","1","2","0","0","767","5761","0","1","1","1","605","605","0","0","0","0","False","False","False"," <hex:022C0DFF07022903EB0203FF02200203> ！你過來玩啦？！<hex:02100103>請盡情地放鬆一下吧！","話說那個比賽廣播在聽眾當中廣受好評啊！<hex:02100103>呵呵，等有機會大家再在一起做有趣的事吧！","0"
"599351","0","1","2","0","0","763","5761","0","1","1","1","605","605","0","0","0","0","False","False","False"," <hex:022C0DFF07022903EB0203FF02200203> ，歡迎來到這裡！<hex:02100103>承諾過會永遠營業的背世咖啡廳，<hex:02100103>今天也迎來了很多客人，非常熱鬧！","隨著賽事的成功舉辦，這裡也越來越有人氣了，<hex:02100103>我真的特別開心！","0"
"599350","0","1","2","0","0","9058","0","0","1","1","1","605","0","0","0","0","0","False","False","False","哦，你來了啊，宇宙賽車的霸者！<hex:02100103>下次要是再出場的話，可以把機器交給我來處理吧！<hex:02100103>啊哈哈哈！！","0","0"
"599369","0","1","2","0","0","933","1071","0","1","1","1","0","0","0","0","0","0","False","False","False","我從富爾什諾閣下那裡聽說了哦，<hex:02100103>你利用哈姆島的乙太，<hex:02100103>再次拯救了世界的危機對吧！","那我也不能輸給你。<hex:02100103>我會儘快完成新的動力裝置，<hex:02100103>讓大家一下子就可以去到月球上！","0"
"599368","0","1","2","0","0","763","0","0","1","1","1","0","0","0","0","0","0","False","False","False","雖然作戰已經結束，但身為一名鍊金術士，<hex:02100103>我對虛無界有著濃厚的興趣。","之前從雅．修特拉那裡聽到關於第一世界的事情時，<hex:02100103>我就被深深地吸引，一直纏著她詢問，一不小心就熬了通宵……<hex:02100103>不過對阿珠達雅大人這樣果然還是不行的吧。","0"
"599371","0","1","2","0","0","767","0","0","1","1","1","0","0","0","0","0","0","False","False","False","得益於那傢伙有記筆記的習慣，<hex:02100103>這邊的準備工作才得以順利完成。<hex:02100103>所以你也得抓緊啊。","0","0"
"599370","0","1","2","0","0","763","0","0","1","1","1","0","0","0","0","0","0","False","False","False","塔的啟動準備工作就交給我吧。<hex:02100103>其他準備工作就由你來。","0","0"
"599373","0","1","2","0","0","763","0","0","1","1","1","0","0","0","0","0","0","False","False","False","接下來要將零的靈魂轉移到吸魂晶中。<hex:02100103>結束之後就要啟動塔了，<hex:02100103>我們到時候在觀星室會合吧。","0","0"
"599372","0","1","2","0","0","768","0","0","1","1","1","0","0","0","0","0","0","False","False","False","看來你那邊也已經準備就緒了啊。<hex:02100103>啟動塔的時刻終於要來臨了！","0","0"
"599375","0","1","2","0","0","767","0","0","1","1","1","0","0","0","0","0","0","False","False","False","嗯？你在這裡做什麼呢？<hex:02100103>現在應該沒什麼事要找我了吧，<hex:02100103>快回到同伴們身邊吧。","0","0"
"599374","0","1","2","0","0","768","0","0","1","1","1","0","0","0","0","0","0","False","False","False","之後的事情就交給你們了。<hex:02100103>我相信你們一定能成功的！","0","0"
"599361","0","1","2","0","0","764","0","0","1","1","1","0","0","0","5","0","0","False","False","False","拉札罕……<hex:02100103>能感受到弗慄多的氣息……","0","0"
"599360","0","1","2","0","0","5533","0","0","1","1","1","0","0","0","0","0","0","False","False","False","等到姐姐身體恢復，可以飛得更高的時候，<hex:02100103>我會帶它去好好感受一下薩維奈的自然風光。<hex:02100103>就像曾經在明月照耀的夜空檔中那樣……","0","0"
"599363","0","1","2","0","0","4219","0","0","1","1","1","0","0","0","0","0","0","False","False","False","月球上的作戰計劃大獲成功。<hex:02100103>相信巴別塔今後也會作為通往月球的傳送手段，<hex:02100103>得到大規模的運用。","0","0"
"599362","0","1","2","0","0","766","0","0","1","1","1","0","0","0","0","0","0","False","False","False","阿爾菲諾閣下和阿莉塞閣下暫時回國了啊……<hex:02100103>如今加雷馬社群已經逐漸步入了正軌，<hex:02100103>相信救援隊撤離的日子也已經不再遙遠了。","0","0"
"599365","0","1","0","0","0","766","0","0","1","1","1","0","0","0","0","0","0","False","False","False","瓦爾桑……今後應該不會再也見不到你了吧？","0","0"
"599364","0","1","2","0","0","738","0","0","1","1","1","0","0","0","0","0","0","False","False","False","總督大人的姐姐平安歸來了啊！<hex:02100103>這真是可喜可賀……那得來一場盛大的宴會好好慶賀一下才行！","0","0"
"599367","0","1","2","0","0","953","0","0","1","1","1","0","0","0","0","0","0","False","False","False","歡迎回來！<hex:02100103>總督大人已經把阿珠達雅大人平安帶回來了！","所以拉札罕決定舉國歡慶一下。<hex:02100103>目前還尚在準備階段，你到時候也一定要來參加啊！","0"
"599366","0","1","2","0","0","5665","933","0","1","1","1","0","0","0","0","0","0","False","False","False","雖然與那傢伙分別的時間不長，<hex:02100103>但對於總督大人強烈思念著見不到的家人的這份心情，<hex:02100103>我多少還是可以感同身受了。","所以我也同樣非常珍惜重逢的這份喜悅。<hex:02100103>你和瓦爾桑能夠平安歸來真是太好了！","0"
"599385","0","1","1","0","0","9074","0","0","1","1","1","0","0","0","0","0","0","False","False","False","沒想到你會如此關心遊末邦的人們。<hex:02100103>剩下的收尾工作就交給我們吧。","0","0"
"599384","0","1","2","0","0","5665","0","0","1","1","1","0","0","0","0","0","0","False","False","False","雖然我從事這份工作已經很久了，<hex:02100103>但搬運光的經歷還是第一次。<hex:02100103>果然有你在真的不會無聊呢。","0","0"
"599387","0","1","1","0","0","0","0","0","1","1","1","0","0","0","0","0","0","False","False","False","雖然時間不長，但能見到你我真的很開心。<hex:02100103>等事情解決後，要記得再來哦！","0","0"
"599386","0","1","1","0","0","9075","0","9072","1","1","1","0","0","0","0","0","0","False","False","False","哦……問題得以順利解決真是太好了。<hex:02100103>畢竟當初誇下了那樣的海口，<hex:02100103>能成功說服市民們也算是沒有辜負這份信任。","不懼光之力，相互扶持……<hex:02100103>這也是遊末邦轉變後的象徵。","雖然我還不敢說<hex:02100103>今後可以聆聽並幫忙解決你的煩惱這種話……<hex:02100103>但我們隨時歡迎你的到來。"
"599389","0","1","1","0","0","9002","0","0","1","1","1","0","0","0","0","0","0","False","False","False","我們因為這次的事情，<hex:02100103>欠下了水晶都的自治組織一個大大的人情啊。<hex:02100103>今後一定得找機會還了這份恩情才行。","0","0"
"599388","0","1","1","0","0","0","0","756","1","1","1","0","0","0","0","0","0","False","False","False","哎呀， <hex:022C0DFF07022903EB0203FF02200203> ！<hex:02100103>故鄉那邊沒問題了嗎？<hex:02100103>我可是一直都很擔心你呢！","要是再遇到什麼煩心事，可以隨時來找我啊！<hex:02100103>當然，來的時候手裡不用拿東西。","就算見不到……<hex:02100103>我也發自內心地期盼著<hex:02100103>阿爾菲諾、零還有大家都能獲得幸福！"
"599391","0","1","2","0","0","4219","0","0","1","1","1","0","0","0","0","0","0","False","False","False","希望零的故鄉能夠順利變回原來的樣子。<hex:02100103>也幫我向瑪托雅大姐帶個好！","0","0"
"599390","0","1","1","0","0","5591","0","9072","1","1","1","0","0","0","0","0","0","False","False","False","我們收到報告稱，光聚集到水晶都的情形，<hex:02100103>從珂露西亞島的近海也可以看得到。","我們還讓士兵隨時待命，以應對混亂的發生……<hex:02100103>不過這樣的麻煩卻並沒有出現，<hex:02100103>大家都期盼著暗之戰士的作戰能夠大獲成功。","就連原本一直沉不住氣走來走去的元首代理，<hex:02100103>也終於老老實實地坐了下來。"
"599377","0","1","2","0","0","4218","0","0","1","1","1","0","0","0","0","0","0","False","False","False","與此次的請求對應的報酬……<hex:02100103>我已經收到了。<hex:02100103>就是那名為希望的贈予未來的禮物。","0","0"
"599376","0","1","2","0","0","763","0","0","1","1","1","0","0","0","0","0","0","False","False","False","哦！你回來啦……<hex:02100103>雖然很想這麼說，但這裡不太方便說話，<hex:02100103>有什麼事就和琳他們一起到觀星室詳談吧。","0","0"
"599379","0","1","2","0","0","5734","0","0","1","1","1","0","0","0","0","0","0","False","False","False","感謝你在各地遊說解釋，<hex:02100103>才讓人們放下心來，避免造成恐慌。<hex:02100103>接下來就是祈禱作戰能成功了！","0","0"
"599378","0","1","2","0","0","933","0","0","1","1","1","0","0","0","0","0","0","False","False","False","對水晶都的居民們的解釋工作已經完成，<hex:02100103>目前正在聯繫各地召集人手。<hex:02100103>等做好準備後就透過私語草進行聯繫吧。","0","0"
"599381","0","1","2","0","0","4219","0","0","1","1","1","0","0","0","0","0","0","False","False","False","太好了！作戰成功了呢！<hex:02100103>我也想把這個喜訊彙報給大家，<hex:02100103>我們到觀星室集合吧。","0","0"
"599380","0","1","2","0","0","4218","0","0","1","1","1","0","0","0","0","0","0","False","False","False","哎呀，怎麼了？<hex:02100103>目前尚在作戰計劃執行過程當中。<hex:02100103>請回到大家的身邊。","0","0"
"599383","0","1","2","0","0","4219","0","0","1","1","1","0","0","0","0","0","0","False","False","False","大家真是受了你不少照顧啊。<hex:02100103>那種程度的事情，以後你可以經常依賴我們。","0","0"
"599382","0","1","2","0","0","5618","0","0","1","1","1","0","0","0","0","0","0","False","False","False","我會活用此次幫助到大家的經驗，<hex:02100103>為今後世界的復興而努力。<hex:02100103>即使相隔千里，我們也要相互扶持！","0","0"
"599401","0","1","2","0","0","738","0","4218","1","1","1","0","0","0","0","0","0","False","False","False","你來了啊，同盟者。<hex:02100103>前不久蛇行枝的魯納爾來到了這裡，<hex:02100103>對你們的事情進行了一番詳細的說明。","你的故鄉肯定和我們隆卡的守護者一樣，<hex:02100103>也有自古傳承下來的智慧吧。<hex:02100103>這些寶貴的東西必須得持久地繼承下去……","聰慧的同盟者，人類的英雄。<hex:02100103>願你的祖國永遠繁榮昌盛。"
"599400","0","1","2","0","0","764","766","0","1","1","1","0","0","0","0","0","0","False","False","False"," <hex:022C0DFF07022903EB0203FF02200203> 你來了啊！<hex:02100103>前一陣接下安裝傳導器的工作時，<hex:02100103>我們討論了是否修理一下拿巴示斷絕的索道礦車的事。","等到空無大地的光變弱之後，廢都也會擁有屬於它的用途。<hex:02100103>說不定那裡有一天也能出現熱鬧的市集……<hex:02100103>到時候你一定要常來啊！","0"
"599403","0","1","2","0","0","709","0","764","1","1","1","0","0","0","0","0","0","False","False","False","哇啊， <hex:022C0DFF07022903EB0203FF02200203> ！<hex:02100103>就在我悠哉悠哉的時候，<hex:02100103>沒想到還能在這裡遇到你！","其實我原本也想著走出雷克蘭德去幫助大家……<hex:02100103>可是奧梅姐姐卻說我只會礙事，給大家添亂，<hex:02100103>勸我打消了這個想法……","不過這次我決定堅定自己的信念，一定要走出去！<hex:02100103>我準備這一次要離開十年，<hex:02100103>所以得跟村裡的同胞們好好道個別才行……"
"599402","0","1","2","0","0","4219","0","933","1","1","1","0","0","0","0","0","0","False","False","False","哎呀，好久不見啊！<hex:02100103>你的皺紋是不是變多了？","開玩笑的啦！<hex:02100103>話說回來，如今世間如此和平，你會不會感到無聊？","夏梅還是一如既往地對外面的世界充滿了好奇，<hex:02100103>要不你下次也帶上她一起去冒險吧！"
"599405","0","1","2","0","0","4218","0","0","1","1","1","0","0","0","0","0","0","False","False","False","怎麼了？有什麼想問的嗎？<hex:02100103>很快就要開始一段漫長的乘船之旅了，<hex:02100103>所以不用著急，我們有的是交流的時間。","必要的物資由我們這邊負責籌備，<hex:02100103>你只需要做好心理準備就行了。","0"
"599404","0","1","2","0","0","763","0","0","1","1","1","0","0","0","0","0","0","False","False","False","和琳約好了去做什麼？<hex:02100103>哦，我是想去妖靈鄉看看，<hex:02100103>但是一個人又太危險了，所以就想找個伴。","有機會的話，我也想去看看海底的古代城邦的幻影。<hex:02100103>那兩個人曾經住過的理想鄉……很難讓人不在意。","0"
"599407","0","1","2","0","0","764","0","0","1","1","1","0","0","0","0","0","0","False","False","False","真沒想到有一天會前往圖拉爾大陸。<hex:02100103>既然要參加繼位儀式，<hex:02100103>那就得努力不扯後腿才行。","而且在那邊獲得的經驗，<hex:02100103>相信也一定可以為加雷馬的人們造福。<hex:02100103>所以一定要盡可能地好好利用這次「休假」才行啊！","0"
"599406","0","1","2","0","0","764","4219","0","1","1","1","0","0","0","0","0","0","False","False","False","其實我也蠻想去艾奧傑亞看看的，<hex:02100103>不過現在沒有那麼多悠閒的時間啊。<hex:02100103>至少希望可以把薩雷安好好看一看。","雖然號稱是學術城邦，<hex:02100103>但也能買到很多不錯的裝備啊！<hex:02100103>還有那邊的大繁榮商店，裡面的東西也都特別棒！","0"
"599393","0","1","2","0","0","5665","0","0","1","1","1","0","0","0","0","0","0","False","False","False","這邊的事情就交給我吧。<hex:02100103>可別讓琳那小姑娘為難哦？","0","0"
"599392","0","1","2","0","0","4218","933","0","1","1","1","0","0","0","0","0","0","False","False","False","戰爭終於結束了啊，太好了！<hex:02100103>畢竟是大姐制定的作戰計劃，我一直都相信可以順利進行的。","話說回來，大姐她希望下次可以直接傳達啊。<hex:02100103>好，我們也要加油啊！","0"
"599395","0","1","2","0","0","4219","0","0","1","1","1","0","0","0","0","0","0","False","False","False","怎麼了？<hex:02100103>該不會是又想坐礦車了吧？<hex:02100103>沒問題，你想坐多久都可以！","0","0"
"599394","0","1","2","0","0","763","0","0","1","1","1","0","0","0","0","0","0","False","False","False","哦，你看起來很有精神啊。<hex:02100103>我也久違地見到了琳那小姑娘，<hex:02100103>看她如今成長得如此出色，我也放心了。","雖然離開家人獨自生活會很孤單，<hex:02100103>但並不意味著共同生活過的過去會消失。<hex:02100103>只要那份記憶還在，她就可以一直堅持下去。","0"
"599397","0","1","0","0","0","766","0","0","1","1","1","0","0","0","0","0","0","False","False","False","我已經很久沒見到傑瑞克這麼開心了……","0","0"
"599396","0","1","2","0","0","950","0","0","1","1","1","0","0","0","0","0","0","False","False","False","你的故鄉也有礦車嗎？<hex:02100103>也會有像我們這樣的礦車愛好者嗎？","為了增加擁有相同愛好的人，<hex:02100103>我們想著要不斷地擴充路線。<hex:02100103>好！這下我更有幹勁了！","0"
